{
  "schema_id": "trix.task-record",
  "schema_version": "0.2",
  "tenant_id": "example-tenant",
  "project_id": "example-project",
  "principal_id": "example-principal",
  "workflow_id": "example-workflow",
  "task_id": "example-task",
  "task_version": "4",
  "controller_epoch": "1",
  "plan_ref": "planref:example-plan",
  "input_revision_ref": "revision:example-inputs",
  "policy_ref": "policy:example-policy",
  "authority_refs": [
    "authref:example-grant"
  ],
  "recorded_at": "2000-01-01T00:01:00Z",
  "lifecycle": "CANCELLED",
  "attempt": {
    "attempt_id": "example-attempt-1",
    "execution": "ACTIVE",
    "knowledge": "STALE",
    "observed_at": "2000-01-01T00:00:10Z",
    "source_ref": "observer:example-executor",
    "evidence_refs": [
      "evidence:example-last-observation"
    ]
  },
  "cancellation": {
    "requested": true,
    "intent_ref": "intent:example-cancel",
    "disposition": "FURTHER_EFFECTS_BLOCKED",
    "evidence_refs": [
      "evidence:example-managed-effects-blocked"
    ],
    "permission_ref": "authref:example-alternative-disposition",
    "cost_tracking_ref": "ledger:example-ongoing-cost"
  },
  "effects": [
    {
      "effect_id": "example-effect-1",
      "destination_ref": "destination:example-local",
      "payload_ref": "payload:example-write",
      "authority_ref": "authref:example-grant",
      "outcome": "APPLIED",
      "evidence_refs": [
        "evidence:example-effect-applied"
      ]
    }
  ],
  "outputs": [],
  "terminal_decision": {
    "status": "CURRENT",
    "evidence_refs": [
      "evidence:example-cancellation-decision"
    ],
    "reliance_blocked": false
  },
  "last_event": {
    "event_id": "example-event-4",
    "actor_ref": "principal:example-coordinator",
    "controller_epoch": "1",
    "causal_refs": [
      "event:example-event-3"
    ],
    "evidence_refs": [
      "evidence:example-reconciliation-entry"
    ]
  },
  "metadata": {
    "org.trix.example": "Illustrative permitted alternative cancellation disposition. Previously applied effects remain recorded; ongoing execution and cost are not concealed."
  }
}
